{
  "profile": "1.0",
  "vault": {
    "uid": "VLT-01ARZ3NDEKTSV4RRFFQ69G5FAY",
    "title": "Demo Bookie vault"
  },
  "allowed_concept_types": [
    "Project",
    "Task",
    "Document",
    "Research",
    "Decision",
    "Activity",
    "Evidence",
    "Person"
  ],
  "policy": {
    "evidence_roots": ["references/files"],
    "exclude": ["exports/**", ".bookie/**"],
    "sensitivity": {
      "classes": ["public", "internal", "restricted"],
      "excluded_classes": ["restricted"]
    },
    "attachment_max_bytes": 26214400
  }
}
